ip_address,created_by,added_at,comment,duration,expires_at
33c:9c7e:ae29:d8bd:c7eb:1078:8ad5:a4ca,4,2025-03-15T23:07:06.475851,Kid skill so country.,3 hours 23 minutes,2025-03-16T02:30:06.475851
60e2:5f3b:3e77:5d85:c0c8:8100:e093:fc04,4,2025-05-02T02:37:47.076076,Mrs least down throughout new sea eye.,11 hours 16 minutes,2025-05-02T13:53:47.076076
efdb:13dc:d68a:1e62:5d0c:ebdd:138b:f90b,4,2025-02-05T18:49:26.344168,Project keep read ask water year pay.,2 hours 45 minutes,2025-02-05T21:34:26.344168
6b6a:a508:e01b:cc77:3251:c864:fd26:dee5,3,2025-01-18T20:09:25.096159,Home top could.,3 hours 13 minutes,2025-01-18T23:22:25.096159
78.7.45.208,6,2025-03-31T06:04:44.895206,Baby fly report own state.,6 hours 53 minutes,2025-03-31T12:57:44.895206
b484:1f85:b4c3:fdb8:cb91:10d1:db78:ee67,1,2025-05-04T23:08:34.135313,What individual site team. Assume few state.,6 hours 22 minutes,2025-05-05T05:30:34.135313
e8f6:2124:19f3:d57f:c97c:96c0:a233:2b07,3,2025-02-20T02:29:27.381701,Particularly all concern together common goal.,11 hours 1 minutes,2025-02-20T13:30:27.381701
70.211.70.3,9,2025-04-27T14:14:48.069494,Project effort main set.,3 hours 17 minutes,2025-04-27T17:31:48.069494
7055:e859:16f3:68a3:bc38:4f55:aa90:7a98,2,2025-04-11T20:50:23.870081,Role source keep scene.,34 minutes,2025-04-11T21:24:23.870081
67.148.84.255,6,2025-01-22T02:24:08.580825,Task nice while coach role religious.,7 hours 42 minutes,2025-01-22T10:06:08.580825
