id,ip_address,created_by,comment,added_at,unblocked_at
1,8457:8ea0:67ad:7855:b4f1:cbde:3433:388d,3,East shoulder industry listen.,2025-02-23T06:53:47.342975,2025-02-23T15:01:47.342975
2,223.140.9.22,9,Reveal present certainly get almost.,2025-01-12T19:41:54.207482,2025-01-13T12:47:54.207482
3,215.75.163.161,3,Opportunity recent foreign hope.,2025-04-09T19:34:28.841281,2025-04-10T14:09:28.841281
4,a4e0:9fbc:d6ba:7bb2:afda:8483:67bb:fd13,10,Understand or create whether talk significant player.,2025-05-13T15:37:10.602607,2025-05-14T11:48:10.602607
5,96.179.195.112,1,Born might might official.,2025-01-21T03:09:34.834339,2025-01-21T12:30:34.834339
6,171.70.90.20,10,Grow particularly per western seek agent sport yourself.,2025-04-24T12:18:22.005743,2025-04-24T14:35:22.005743
7,1d6a:d531:f280:279d:bd0a:bbca:dc4d:7796,8,Often our them speech dinner collection already.,2025-02-27T18:33:20.490740,2025-02-28T08:29:20.490740
8,113.240.27.247,10,Whatever third herself allow represent out audience look.,2025-03-19T17:26:00.538733,2025-03-19T23:59:00.538733
9,2153:39d1:9a89:cee8:68e9:26ef:80de:f924,3,Safe food eye catch.,2025-01-04T15:13:45.786987,2025-01-05T03:38:45.786987
10,5564:8e87:e252:27b9:b232:49f5:30ec:12b1,9,Manager design mind poor blue.,2025-05-17T22:20:35.929446,2025-05-18T21:51:35.929446
11,90.121.48.141,10,Attorney simply team trip then trade.,2025-02-06T04:00:47.497111,2025-02-07T03:13:47.497111
12,129.77.13.148,8,Picture later school goal.,2025-05-21T17:10:29.586921,2025-05-21T22:22:29.586921
13,9353:da3e:cabf:166b:97b8:58c4:f693:301b,10,Against create fear tonight.,2025-01-24T13:22:37.807280,2025-01-25T10:16:37.807280
14,27.50.185.161,10,Than spend find picture indicate fight best.,2025-04-20T05:27:16.995687,2025-04-20T21:46:16.995687
15,198.67.230.44,4,Generation arm sing foot of our.,2025-04-10T12:37:19.928401,2025-04-11T01:25:19.928401
