id,ip_address,created_by,comment,added_at,unblocked_at
1,16.62.28.31,6,Far information book pull onto some.,2025-04-17T08:17:05.486267,2025-04-17T20:42:05.486267
2,91c:5a0a:fe63:41b2:bc3d:cccd:e779:48dd,4,Include deal amount production scientist me.,2025-01-10T17:43:29.379562,2025-01-11T04:08:29.379562
3,9547:1e2:ab54:d76b:a204:2ab2:6da7:9c14,7,Particular clear perform.,2025-03-30T06:04:14.705738,2025-03-30T10:49:14.705738
4,83fe:469a:92fd:251f:d53c:ccdb:a843:d4dc,6,Course team month next scene.,2025-04-17T17:14:48.342674,2025-04-17T19:10:48.342674
5,5093:5a33:a7eb:a9a4:7214:cb12:2375:ac4d,8,Music station account carry her.,2025-03-24T01:50:26.906777,2025-03-24T09:55:26.906777
6,b62e:3796:8bc4:816d:2ac5:d104:b71a:c9df,5,Nearly rather time statement professor.,2025-01-05T13:35:38.615030,2025-01-05T23:57:38.615030
7,192.158.230.82,2,Me natural test these body entire half.,2025-03-27T23:04:41.995956,2025-03-28T02:51:41.995956
8,e603:ab28:1cc4:b7b4:6f8a:46e8:89e6:2b5e,5,Half heavy central.,2025-06-08T18:08:05.324996,2025-06-09T16:34:05.324996
9,636:eea9:c18e:6856:54b0:df80:4fd4:5cf4,7,Six what successful control leader.,2025-04-30T14:11:56.076309,2025-05-01T02:30:56.076309
10,53.233.6.152,8,Between maybe within budget.,2025-02-21T16:58:16.232917,2025-02-22T14:08:16.232917
11,fa46:14b8:5ef5:58d6:d062:8cbf:aa26:6968,4,Hundred well behavior effort whatever positive.,2025-03-27T05:50:33.192408,2025-03-28T02:27:33.192408
12,66b8:f818:5bd0:c2cd:f124:db2a:c1dd:7355,1,Set just media front.,2025-04-10T15:48:17.097551,2025-04-11T10:55:17.097551
13,78.193.136.35,2,Address local main food accept these show.,2025-03-17T10:28:22.679530,2025-03-18T06:11:22.679530
14,157.29.158.152,10,Wish site spend campaign inside without water.,2025-02-10T09:54:23.107230,2025-02-11T04:16:23.107230
15,baa:13b2:a4d6:9d6e:d1f1:73f2:1ff5:1130,7,Almost region present dog.,2025-01-23T14:59:18.202420,2025-01-24T05:18:18.202420
