ip_address,created_by,comment,added_at,duration,blocks_count,expires_at
1234:e952:3efb:fe2:f81f:ffd6:727:892c,7,Grow study husband line medical compare least.,2025-05-06T05:28:06.153663,23 hours 3 minutes,104,2025-05-07T04:31:06.153663
faf0:cdd1:b55d:2cef:3530:a1af:80da:148,6,Thank term product lawyer staff capital.,2025-04-14T01:14:14.578035,5 hours 58 minutes,189,2025-04-14T07:12:14.578035
6527:78ee:b2e9:1af4:b60d:9891:a05b:89d1,1,Good price air can family yet nor.,2025-04-30T07:08:44.694149,4 hours 46 minutes,187,2025-04-30T11:54:44.694149
194.189.34.218,7,Thousand to room rock will difficult.,2025-02-11T19:30:05.570965,23 hours 58 minutes,3,2025-02-12T19:28:05.570965
33.78.96.133,1,List though executive process media.,2025-05-01T07:36:44.470175,46 hours 19 minutes,139,2025-05-03T05:55:44.470175
3.179.253.87,3,Wish should each including worry.,2025-06-12T00:22:49.525676,14 hours 17 minutes,34,2025-06-12T14:39:49.525676
86.92.117.115,2,In his hand because figure not human.,2025-01-30T21:23:27.884118,19 minutes,22,2025-01-30T21:42:27.884118
9.116.19.36,1,Reason return better require.,2025-04-26T00:27:10.234865,46 hours 12 minutes,103,2025-04-27T22:39:10.234865
57e1:e695:9109:ff8f:7229:c1d4:9112:7c14,7,Thought evening vote truth case history agreement dream.,2025-04-30T05:45:27.491769,12 hours 35 minutes,195,2025-04-30T18:20:27.491769
60.194.242.196,3,Manager dinner particularly story guess.,2025-01-24T21:55:07.546398,11 hours 53 minutes,194,2025-01-25T09:48:07.546398
40.157.135.71,2,Now drop all travel it eight almost benefit.,2025-01-04T12:07:27.935400,30 hours 16 minutes,25,2025-01-05T18:23:27.935400
5ffc:4ebd:d347:2484:adeb:7624:ab72:bc69,1,Perform vote behind public.,2025-03-15T17:16:31.797173,5 hours 51 minutes,100,2025-03-15T23:07:31.797173
f341:21a2:1d6d:b521:b65d:1082:1667:8f39,9,Live nation firm.,2025-06-01T01:37:48.302643,46 hours 27 minutes,60,2025-06-03T00:04:48.302643
159d:7b72:6aa5:e5a3:6855:d69d:d3bf:2286,4,Reach money bring reveal night think.,2025-03-18T06:49:06.631575,36 hours 55 minutes,130,2025-03-19T19:44:06.631575
ea81:4f4a:1642:24cf:dc46:55a0:d72e:d7d2,1,Others thus report old security dog certain.,2025-02-07T03:40:14.396082,1 hours 27 minutes,100,2025-02-07T05:07:14.396082
180.66.48.178,1,Little concern reveal thank.,2025-01-24T20:53:33.115962,10 hours 14 minutes,197,2025-01-25T07:07:33.115962
44fa:2bf4:20b3:3d5c:3036:995b:6206:f3b3,6,Keep expect popular project change them condition forward.,2025-02-21T00:32:23.252351,22 hours 28 minutes,35,2025-02-21T23:00:23.252351
114.10.181.212,3,Actually future drop similar institution media back.,2025-03-06T08:37:54.113594,34 hours 21 minutes,143,2025-03-07T18:58:54.113594
88f7:39ce:96e4:b65:2ac7:f895:73e4:f878,7,Key after speak.,2025-03-05T02:11:17.270764,31 hours 29 minutes,27,2025-03-06T09:40:17.270764
103.223.66.46,10,Easy wide easy every provide case church.,2025-02-16T19:48:46.822381,40 hours 16 minutes,41,2025-02-18T12:04:46.822381
